{
  "id": "BILLING-CHANGE-2049",
  "linked_item": "JIRA-BILL-123",
  "impact": 5,
  "uncertainty": 4,
  "hazard": "If new billing job mis-parses CSV, then double-charges occur in EU region.",
  "recheck": { "due_time": "2025-11-10T17:00:00Z", "jump_trigger": "alert:billing_errors>50/min" },
  "steward": { "primary": "Ops On-Call", "backup": "Billing Lead" },
  "authority_window": { "scope_limit": "10% users", "time_limit": "2h", "auto_pause": true },
  "two_key_ttl": { "required": true, "approvers": ["EngMgr","SRELead"], "ttl_hours": 4 },
  "kill_criteria": [
    { "condition": "error_rate > 0.01", "action": "rollback" },
    { "condition": "any_double_charge == true", "action": "rollback" }
  ],
  "evidence_links": [
    { "name": "Load Test", "url": "https://example.com/perf.pdf" },
    { "name": "Incident INC-2045", "url": "https://example.com/inc-2045" },
    { "name": "Runbook", "url": "https://example.com/runbook" }
  ]
}