{
  "id": "POLICY-PILOT-ENUS-003",
  "linked_item": "POLICY-MEMO-2025-12-X",
  "impact": 5,
  "uncertainty": 4,
  "hazard": "If we expand the hate meme classifier, false positives on satire may increase while coded hate false negatives persist in EN–US.",
  "recheck": { "due_time": "2025-12-15T00:00:00Z", "jump_trigger": "appeals_rate_7d > 1.5 * baseline" },
  "steward": { "primary": "Policy Owner", "backup": "Safety Reviewer" },
  "authority_window": { "scope_limit": "EN–US 10% cohort; exclude news/politics", "time_limit": "30d", "auto_pause": true },
  "two_key_ttl": { "required": true, "approvers": ["Policy Lead","Legal Counsel"], "ttl_hours": 720 },
  "kill_criteria": [
    { "condition": "verified_wrongful_rate_per_10k >= 0.8", "action": "Pause policy; convene review within 48h" },
    { "condition": "incident_severity >= 2", "action": "Immediate pause; notify exec/legal" }
  ],
  "evidence_links": [
    { "name": "Risk Assessment v1.2", "url": "https://example.org/risk-assess-1-2" }
  ]
}